{"$schema":"https://json-schema.org/draft/2020-12/schema","$id":"urn:contract-v7:r19:validation-report","title":"R19 validation report","type":"object","additionalProperties":false,"required":["report_contract_version","generated_by","scope","status","unit_tests","live_preflight","artifacts","failure_classification"],"properties":{"report_contract_version":{"const":"R19-VALIDATION-REPORT-V1"},"generated_by":{"type":"string","minLength":1},"scope":{"const":"audit_only_v7_builder_scaffold_v2"},"status":{"enum":["PASS_WITH_EXPECTED_LIVE_BLOCK","FAIL"]},"unit_tests":{"type":"object"},"live_preflight":{"type":"object"},"artifacts":{"type":"array","items":{"$ref":"#/$defs/artifact"}},"failure_classification":{"type":"array","items":{"type":"string","minLength":1}}},"$defs":{"sha256":{"type":"string","pattern":"^[0-9a-f]{64}$"},"artifact":{"type":"object","additionalProperties":false,"required":["relative_path","raw_sha256"],"properties":{"relative_path":{"type":"string","minLength":1},"raw_sha256":{"$ref":"#/$defs/sha256"}}}}}
