{
  "report_contract_version": "R19-VALIDATION-REPORT-V1",
  "generated_by": "Python 3.9.6 stdlib-only validation",
  "scope": "audit_only_v7_builder_scaffold_v2",
  "status": "PASS_WITH_EXPECTED_LIVE_BLOCK",
  "unit_tests": {
    "status": "PASS",
    "count": 95,
    "command": "PYTHONDONTWRITEBYTECODE=1 python3 run_tests.py",
    "duration_seconds": 0.100,
    "formal_inputs": "read_only",
    "synthetic_outputs": "/private/tmp only"
  },
  "live_preflight": {
    "status": "BLOCKED",
    "error_code": "E_UPSTREAM_PREREQUISITE",
    "exit_code": 3,
    "first_check": "formal_post_113_validator_hash",
    "expected_validator_raw_sha256": "c2dc1319f39b5eaaf353274113a5c08b9ca5df3a33636f50517ecbbe3265fbf0",
    "actual_validator_raw_sha256": "44756009c8791d44a6164aa55b9360cde2a5aa1275b2889b3b5c720e1db9736f",
    "controlled_input_directory": "missing",
    "independent_prerequisite_chain": "missing",
    "source_pool_review_hash": "satisfied",
    "source_pool_operations_hash": "satisfied",
    "transaction_created": false,
    "snapshot_created": false,
    "candidate_created": false,
    "windows_gate_claimed": false
  },
  "artifacts": [
    {"relative_path": "README.md", "raw_sha256": "f16ad9131d0d0de3b585c882e6ed70826af65823ee1a6f43791116035c029f68"},
    {"relative_path": "fixtures/chip-artifact-dag.json", "raw_sha256": "3fe8e327fa40fbb7da6d93e629d1bf1ca73901232da8c88a03109049b4dcbb55"},
    {"relative_path": "fixtures/contract-artifact-dag.json", "raw_sha256": "95fbaf9b2edb703fa68c919191fc99c250abd0ae80f7bbb25bbba04e9bb3b16b"},
    {"relative_path": "fixtures/semantic-path-oracles.json", "raw_sha256": "8d2b4cfa56af5411656f8ccdd1fc8429c50407bff0798408d9dd21a0a214e61f"},
    {"relative_path": "run_live_preflight.py", "raw_sha256": "938551e7b4de8c56969c34edc5248932ac8e4a378bfb8d65c4a6504a8e6b40b6"},
    {"relative_path": "run_tests.py", "raw_sha256": "256191e9b4fbaa07ced6bb7b0717d55cbf156f001b79583dd474be7492351335"},
    {"relative_path": "schemas/artifact-approval.schema.json", "raw_sha256": "d7b54823c13e897563af63af404955846e811518a804f098e13b8d25aa2c8c6e"},
    {"relative_path": "schemas/bootstrap-item.schema.json", "raw_sha256": "812f7a669a7659b90c5c6a4a7132b59dd333217dbb3a05076f33addff22dbe0f"},
    {"relative_path": "schemas/source-pool-prerequisite.schema.json", "raw_sha256": "5545a908e690faefe4fa9e39aa2c1e161c75b2176105eb4714dd42df01583d82"},
    {"relative_path": "schemas/validation-report.schema.json", "raw_sha256": "b4111fac18723d10ebb53b90e118ecad266a45f8cd0e16194527d13deb4e331b"},
    {"relative_path": "src/v7_builder_v2/__init__.py", "raw_sha256": "aeaf05d7605d28184566e27bb130dceceffddc1131a65ddbf2a4e305461ce974"},
    {"relative_path": "src/v7_builder_v2/authorization.py", "raw_sha256": "57f39fc70ebcd5f61cfba60bb893651b2ad1efb9fff95665af29fed7df53e05a"},
    {"relative_path": "src/v7_builder_v2/bootstrap.py", "raw_sha256": "5024f65d989c670a8389928af13bca0e4a1443c4d17c050633600cdb0a0a4254"},
    {"relative_path": "src/v7_builder_v2/canonical.py", "raw_sha256": "d502e68a902d1cba6494f633f2a17e5126dcb95a3177adb4682f386059a690dc"},
    {"relative_path": "src/v7_builder_v2/dag.py", "raw_sha256": "3eca3441c3ead490ff88e967fffa9b28a2f4b2541f3a8f7e1c50149e9ec3a255"},
    {"relative_path": "src/v7_builder_v2/errors.py", "raw_sha256": "a0474ea22b3b063ff9150116921441955f30744b9357e0fb5fd59af8702298f7"},
    {"relative_path": "src/v7_builder_v2/formula.py", "raw_sha256": "d80d6ade1f46c97b78c78c179a03f93dc008570850722458952b3e458edd425f"},
    {"relative_path": "src/v7_builder_v2/freeze_scope.py", "raw_sha256": "d33c14ed97f012089b0bb3451d63b6df4256d039cbf52a67e4560036212a86e6"},
    {"relative_path": "src/v7_builder_v2/guard.py", "raw_sha256": "f8800ae0ff51b9f0779a2f04d98952fa94af0d3d6e10c5df577a3c7e0bc51804"},
    {"relative_path": "src/v7_builder_v2/mapping.py", "raw_sha256": "38016175bb3918920655198f26be7722327f77c9d8e88b53de8150dd0fdf601c"},
    {"relative_path": "src/v7_builder_v2/pathing.py", "raw_sha256": "e3d6701f45f9e6f785054b863bfd64ead02c16872cfd338e5d060036262439c4"},
    {"relative_path": "src/v7_builder_v2/preflight.py", "raw_sha256": "9ac9ecfa80f01873e358df1068124cbffabc6a47a2e973511cb7f757c2d91a8b"},
    {"relative_path": "src/v7_builder_v2/principals.py", "raw_sha256": "38d710144997720f14c47316c1ab3d768dea59478df136e06f713170ed3c9c4b"},
    {"relative_path": "src/v7_builder_v2/schemas.py", "raw_sha256": "fbd33bdae440c0439c001a40ec63b7741ad35b1a9ab6607e22c85cf2e9941d9b"},
    {"relative_path": "tests/__init__.py", "raw_sha256": "01ba4719c80b6fe911b091a7c05124b64eeece964e09c058ef8f9805daca546b"},
    {"relative_path": "tests/support.py", "raw_sha256": "62e50552154da59188b804dc616624cc1aa9b5f20baf15ecf6e85c02dbcc47bc"},
    {"relative_path": "tests/test_contracts.py", "raw_sha256": "ef148a45f6617eb8c6df0cff79851eb64c0032613c269effc8e9d3004f627f04"},
    {"relative_path": "tests/test_core.py", "raw_sha256": "fe77ae2c2d12457b5a95dd283e760b0de9b4ad4de742e523e5158da3dcefa240"},
    {"relative_path": "tests/test_live_and_guard.py", "raw_sha256": "2f362144f5268f9f74df07e9ba8813661dd509a689804c5620f39d214b173018"}
  ],
  "failure_classification": [
    "expected upstream prerequisite block: live source-pool-113 promotion is incomplete",
    "sandbox denial: initial py_compile tried the protected user cache; rerun with PYTHONPYCACHEPREFIX under /private/tmp passed",
    "model/operator mistake: first test fixtures for SemanticPath and bad input_order were malformed; corrected before the final 95-test PASS",
    "model/operator mistake: first live CLI default root resolved to the outer workspace; corrected to the mainline root before the recorded BLOCKED run",
    "project state limitation: the workspace is not a Git repository, so scope was verified by path inventory and hashes"
  ]
}
